name,address,city,state,postal_code,latitude,longitude,stars,review_count,is_open,categories
Uncle Sam's Submarines,5808 Forbes Ave,Pittsburgh,PA,15217,40.4378475933,-79.9228814523,4.0,105,1,"American (Traditional), Sandwiches, Restaurants"
Sree's Indian Truck,Margaret Morrison St,Pittsburgh,PA,15213,40.4417051054,-79.9416196346,3.0,4,0,"Restaurants, Indian, Food Stands, Food"
Stack'd Burgers & Beer - Oakland,3716 Forbes Ave,Pittsburgh,PA,15213,40.4413253,-79.9568899,3.5,107,1,"Nightlife, Restaurants, American (Traditional), Food, Beer, Wine & Spirits, Bars, Burgers"
Pacific Ring,1900 Murray Ave,Pittsburgh,PA,15217,40.4358767,-79.92287,3.0,14,0,"Sushi Bars, Dim Sum, Restaurants, Chinese"
Hair by G & E,288 Morewood Ave,Pittsburgh,PA,15213,40.4543563,-79.9446292,4.5,37,1,"Beauty & Spas, Hair Salons"
Wendy's,4524 Browns Hill Rd,Pittsburgh,PA,15217,40.416731,-79.925176,1.5,18,1,"Restaurants, Fast Food, Burgers"
Total Handy Services,5542 Pocusset St,Pittsburgh,PA,15217,40.4297042,-79.9291407,2.5,15,1,"Home Services, Handyman"
Gene's Place,3616 Louisa St,Pittsburgh,PA,15213,40.4394328,-79.9560956,4.0,26,1,"Dive Bars, Nightlife, Bars"
Rite Aid,1700 Murray Ave,Pittsburgh,PA,15217,40.4378235,-79.9232406,3.0,20,1,"Shopping, Convenience Stores, Food, Drugstores"
Ribs N Bread,4707 Centre Ave,Pittsburgh,PA,15213,40.4528416,-79.9493702,3.5,3,1,"Restaurants, Barbeque, Southern"
Italian Village Pizza,5886 Forbes Ave,Pittsburgh,PA,15217,40.4379074,-79.9195552,3.5,32,0,"Restaurants, Pizza"
Wyndham Pittsburgh University Center,100 Lytton Avenue,Pittsburgh,PA,15213,40.4459408154,-79.9548240259,2.5,66,1,"Hotels, Hotels & Travel, Event Planning & Services"
Veraldi Hair Beauty Wellness,4606 Winthrop St,Pittsburgh,PA,15213,40.445741,-79.9483648,4.5,42,1,"Beauty & Spas, Hair Salons"
Schoolhouse Yoga,2215-2217 Murray Ave,Pittsburgh,PA,15217,40.4322243,-79.9230504,4.5,12,1,"Yoga, Active Life, Fitness & Instruction"
Eureka Chocolates and Gifts,735 Copeland St,Pittsburgh,PA,15232,40.4511817,-79.9344636,5.0,6,1,"Coffee & Tea, Shopping, Arts & Crafts, Chocolatiers & Shops, Desserts, Flowers & Gifts, Candy Stores, Specialty Food, Cards & Stationery, Event Planning & Services, Food"
Tango Cafe,5806 Forward Ave,Pittsburgh,PA,15217,40.4296328,-79.9231618,4.5,9,0,"Restaurants, Food, Desserts, Latin American, Coffee & Tea, Sandwiches"
The Cake & Cookie Spot,2108 Murray Ave,Pittsburgh,PA,15217,40.4333704,-79.923237,5.0,20,0,"Food, Desserts, Bakeries"
Shadyside Variety Store,5421 Walnut St,Pittsburgh,PA,15232,40.4510796,-79.9345209,4.0,13,1,"Shopping, Toy Stores"
Tong's Cuisine,228 Semple St,Pittsburgh,PA,15213,40.4394597,-79.9581963,3.5,45,1,"Chinese, Restaurants"
Giant Eagle,1901 Murray Ave,Pittsburgh,PA,15217,40.4355091425,-79.9226289759,2.0,46,1,"Shopping, Food, Drugstores, Grocery"
A 1 Garage Door Repair Service,,Pittsburgh,PA,15217,40.4327086,-79.9248669,5.0,7,1,"Garage Door Services, Home Services, Keys & Locksmiths"
Tan 360,822 S Aiken Ave,Pittsburgh,PA,15232,40.4503189,-79.9359108,2.5,8,1,"Beauty & Spas, Tanning"
Pearl Nail Salon,5829-5831 Forward Ave,Pittsburgh,PA,15217,40.4296264,-79.9224779,4.5,69,1,"Beauty & Spas, Nail Salons"
Complete Family Vision Care,"201 N Craig St, Ste 105",Pittsburgh,PA,15213,40.4499132,-79.9511841,4.0,9,1,"Health & Medical, Optometrists"
Magee Womens Hospital of UPMC,300 Halket St,Pittsburgh,PA,15213,40.4375401,-79.9603989,4.0,17,1,"Obstetricians & Gynecologists, Hospitals, Doctors, Health & Medical"
Journeys of Life,810 Bellefonte St,Pittsburgh,PA,15232,40.4508023,-79.93376,4.5,12,1,"Bookstores, Books, Mags, Music & Video, Flowers & Gifts, Gift Shops, Shopping"
Heart of the Earth,738 Copeland St,Pittsburgh,PA,15232,40.4510637,-79.9348095,3.0,7,0,"Flowers & Gifts, Gift Shops, Shopping, Accessories, Jewelry, Arts & Crafts, Fashion"
Rodef Shalom Congregation,4905 5th Ave,Pittsburgh,PA,15213,40.4479845,-79.9434692,4.5,4,1,"Religious Organizations, Public Services & Government, Venues & Event Spaces, Event Planning & Services, Landmarks & Historical Buildings, Synagogues"
X Shadyside,5608 Walnut St,Pittsburgh,PA,15232,40.451566,-79.931741,4.0,59,1,"Gyms, Active Life, Trainers, Fitness & Instruction, Tanning, Beauty & Spas, Yoga"
"Marvin A Dash, DMD","6301 Forbes Ave, Ste 230",Pittsburgh,PA,15217,40.4380637,-79.9195269,3.0,6,1,"Dentists, Health & Medical, General Dentistry, Oral Surgeons"
Nak Won Garden,5504 Centre Ave,Pittsburgh,PA,15232,40.4565667,-79.936316,3.5,111,1,"Korean, Barbeque, Restaurants, American (New)"
The Warehouse Pub & Grub,1731 Murray Ave,Pittsburgh,PA,15217,40.437116,-79.9226226,3.0,3,1,"Bars, Nightlife, Pubs, Restaurants, American (Traditional), Food"
The Bagel Factory,420 S Craig St,Pittsburgh,PA,15213,40.4445302592,-79.9488186836,2.0,204,1,"Restaurants, Coffee & Tea, Food, Bagels"
Meyers Management,"5 Bayard Rd, Fl 1",Pittsburgh,PA,15213,40.452713,-79.9428609,2.5,9,1,"Home Services, Real Estate, Apartments"
Naya Cuisine,2018 Murray Ave,Pittsburgh,PA,15217,40.434190366,-79.9230114,4.0,102,1,"Diners, Restaurants, Middle Eastern"
Maduro Smoke Shop,5835 Forward Ave,Pittsburgh,PA,15217,40.4295686,-79.9223559,4.0,10,0,"Tobacco Shops, Shopping"
Chakh Le India,4341-4379 Bigelow Blvd,Pittsburgh,PA,15213,40.4452102456,-79.955705317,4.0,20,1,"Indian, Restaurants, Food, Food Trucks"
Chick-fil-A,"3990 5th Ave, University of Pittsburgh Tower, University Of Pittsburgh Tower",Pittsburgh,PA,15213,40.44418,-79.95341433,2.5,3,1,"Event Planning & Services, Fast Food, Caterers, Restaurants"
Gap,5436 Walnut St,Pittsburgh,PA,15232,40.450823,-79.934028,3.5,10,1,"Shopping, Fashion, Children's Clothing, Accessories, Men's Clothing, Women's Clothing"
Einstein Bros Bagels,4910 Baum Blvd,Pittsburgh,PA,15213,40.454553,-79.946117,4.0,30,1,"Coffee & Tea, Bagels, Sandwiches, Food, Restaurants"
Skibo Cafe,"5000 Forbes Ave, 2nd Fl",Pittsburgh,PA,15213,40.4434658,-79.9434567,2.5,11,0,"Pizza, Sandwiches, Cafes, Restaurants, American (Traditional)"
Trapuzzano Italian Chophouse,5533 Walnut St,Pittsburgh,PA,15232,40.4517190815,-79.9326984898,3.5,45,0,"Italian, Restaurants"
Kebab Factory,121 Oakland Ave,Pittsburgh,PA,15213,40.4417404014,-79.9570810447,3.5,34,0,"Mediterranean, Restaurants, Greek"
"Carnegie Library of Pittsburgh, Squirrel Hill",5801 Forbes Ave,Pittsburgh,PA,15217,40.4384414,-79.9227826,4.5,22,1,"Libraries, Public Services & Government"
Drift Hookah Lounge,"2236 Murray Ave, Fl 1",Pittsburgh,PA,15217,40.4317136,-79.9233525,5.0,17,1,"Bars, Nightlife, Hookah Bars"
Soba,5847 Ellsworth Ave,Pittsburgh,PA,15232,40.4571033,-79.9296345,4.0,310,1,"Chinese, Korean, Japanese, Restaurants, Asian Fusion"
Ginza Korean & Japanese Restaurant,239 Atwood St,Pittsburgh,PA,15213,40.440304,-79.956279,3.0,13,0,"Japanese, Restaurants, Korean"
iNoodle,1060 Morewood Ave,Pittsburgh,PA,15213,40.4454444,-79.9432431,2.0,4,1,"Noodles, Restaurants, Chinese"
The Shady Dog,Corner Of Baum And Libert,Pittsburgh,PA,15232,40.451096,-79.9332613,4.5,10,1,"Hot Dogs, Restaurants, Street Vendors, Food"
J. Reisner Notary,2232 Wightman St,Pittsburgh,PA,15217,40.430071,-79.92797,4.0,16,1,"Professional Services, Home Services, Real Estate Services, Local Services, Departments of Motor Vehicles, Real Estate, Public Services & Government, Legal Services, Notaries"
UPMC Eye Center - Eye & Ear Institute,203 Lothrop St,Pittsburgh,PA,15213,40.441782,-79.961203,2.5,3,1,"Ophthalmologists, Doctors, Health & Medical, Optometrists"
Logan's Pub,301 N Craig St,Pittsburgh,PA,15213,40.451923,-79.952266,3.0,6,1,"Bars, Nightlife, Dive Bars, Pubs"
Friendship Suites,301 Stratford Ave,Pittsburgh,PA,15232,40.460781,-79.933116,4.0,3,1,"Hotels, Guest Houses, Home Services, Real Estate, Hotels & Travel, Event Planning & Services"
Salud Juicery,3400 Fifth Ave,Pittsburgh,PA,15213,40.4390806577,-79.9618649483,5.0,3,1,"Juice Bars & Smoothies, Food"
Aspen Dental,4815 Centre Ave,Pittsburgh,PA,15213,40.4536277,-79.9470256,1.0,6,0,"Health & Medical, Dentists, Oral Surgeons, General Dentistry"
Vanderbeck Integrative Therapies,5850 Ellsworth Ave,Pittsburgh,PA,15232,40.4568156,-79.9293258,3.5,3,1,"Health Coach, Beauty & Spas, Health & Medical, Massage Therapy, Medical Spas, Massage, Reflexology"
Moonlight Truck Food,Margaret Morrison St,Pittsburgh,PA,15213,40.442195025,-79.9385726452,3.0,6,1,"Chinese, Food Trucks, Food, Food Stands, Restaurants"
Hampton Inn Pittsburgh University\/Medical Center,3315 Hamlet St,Pittsburgh,PA,15213,40.4363985,-79.9632833,3.5,48,1,"Hotels & Travel, Event Planning & Services, Hotels"
Tan Izakaya,815 S Aiken Ave,Pittsburgh,PA,15232,40.4504837,-79.9351521,3.5,89,0,"Ramen, Japanese, Restaurants, Sushi Bars"
Bright Light Academy,5618 Kentucky Ave,Pittsburgh,PA,15232,40.4502407,-79.9302456,3.5,3,1,"Child Care & Day Care, Education, Preschools, Local Services"
American Apparel,5509 Walnut St,Pittsburgh,PA,15232,40.4514502,-79.9333539,3.0,5,0,"Fashion, Men's Clothing, Shopping, Women's Clothing, Accessories"
BoRics Hair Care,4028 Beechwood Blvd,Pittsburgh,PA,15217,40.427106,-79.937684,4.0,4,0,"Barbers, Hair Salons, Hair Stylists, Beauty & Spas"
Royal York Apartments,3955 Bigelow Blvd,Pittsburgh,PA,15213,40.4529229,-79.9536756,4.5,5,1,"Apartments, Real Estate, Home Services"
Kawaii Gifts,738 Copeland St & 5413-B Walnut St,Pittsburgh,PA,15232,40.451,-79.9348937,4.5,26,1,"Gift Shops, Flowers & Gifts, Shopping, Toy Stores"
Optical Outlet,4048 Beechwood Blvd,Pittsburgh,PA,15217,40.4270688,-79.937582,4.0,3,1,"Optometrists, Health & Medical, Shopping, Eyewear & Opticians"
PNC Bank,4031 Fifth Ave,Pittsburgh,PA,15213,40.4437943926,-79.9560623249,3.5,3,1,"Financial Services, Real Estate, Investing, Mortgage Brokers, Home Services, Banks & Credit Unions"
Hidden Harbor,1708 Shady Ave,Pittsburgh,PA,15217,40.4376509,-79.9195142,4.5,145,1,"Restaurants, Cocktail Bars, Nightlife, Bars, Hawaiian"
FurEver Pet Salon,2633 Murray Ave,Pittsburgh,PA,15217,40.4289455,-79.9239986,5.0,7,0,"Pets, Pet Services, Pet Groomers"
Crazy Mocha Coffee,207 Oakland Ave,Pittsburgh,PA,15213,40.4414009,-79.9566425,4.0,13,1,"Food, Coffee & Tea"
YinzBurgh BBQ,4903 Baum Blvd,Pittsburgh,PA,15213,40.4552574159,-79.9461903067,4.0,170,1,"Vegan, Restaurants, Southern, Barbeque"
Mystery Key Escape Room,2701 Murray Ave,Pittsburgh,PA,15217,40.4287351,-79.9239666,3.0,5,1,"Active Life, Escape Games"
Pittsburgh Center For The Arts,6300 5th Ave,Pittsburgh,PA,15232,40.4525711,-79.9202103,3.0,3,1,"Art Galleries, Art Classes, Museums, Arts & Entertainment, Shopping, Education"
University of Pittsburgh,3512 5th Ave,Pittsburgh,PA,15213,40.443763819,-79.9626830238,4.0,16,1,"Education, Colleges & Universities"
Silk Pagoda Restaurant,4070 Beechwood Blvd,Pittsburgh,PA,15217,40.4274093,-79.9382045,3.0,14,0,"Chinese, Restaurants"
Sushi Too,5432 Walnut St,Pittsburgh,PA,15232,40.4507666,-79.9341321,3.0,132,1,"Sushi Bars, Japanese, Restaurants, Seafood"
Star Nail,4375 Murray Ave,Pittsburgh,PA,15217,40.419879,-79.9282516,4.0,24,1,"Beauty & Spas, Nail Salons"
The Homewood Cemetery,1599 S Dallas Ave,Pittsburgh,PA,15217,40.441137,-79.912431,5.0,6,1,"Funeral Services & Cemeteries, Local Services"
Lezzet,416 Semple St,Pittsburgh,PA,15213,40.436539,-79.95473,4.0,3,0,"Food, Restaurants, Mediterranean, Turkish"
Fossil Fuels Café,4400 Forbes Ave,Pittsburgh,PA,15213,40.4432988,-79.9500527,3.5,3,1,"American (Traditional), Cafes, Restaurants, Fast Food"
Open Bottle Bistro,5884 Ellsworth Ave,Pittsburgh,PA,15232,40.457682,-79.9279112,3.5,16,0,"American (New), Wine Bars, Restaurants, Bars, Nightlife"
Womens Choice Network,"4615 Fifth Ave, Ste 202",Pittsburgh,PA,15213,40.447175,-79.9481312,2.5,5,1,"Medical Centers, Fertility, Laboratory Testing, Diagnostic Services, Obstetricians & Gynecologists, Health & Medical, Doctors"
Rite Aid,209 Atwood St,Pittsburgh,PA,15213,40.440865,-79.957019,3.0,3,1,"Shopping, Drugstores, Food, Cosmetics & Beauty Supply, Convenience Stores, Beauty & Spas"
Smallman Street Deli,1912 Murray Ave,Pittsburgh,PA,15217,40.435624,-79.923101,3.5,124,1,"Restaurants, Event Planning & Services, Caterers, Delis, Sandwiches"
Schatz Dining Hall,5032 Forbes Ave,Pittsburgh,PA,15213,40.443081,-79.942568,3.5,10,1,"Restaurants, Buffets"
Kevin's Deli,101 N Dithridge St,Pittsburgh,PA,15213,40.4469698,-79.9507326,4.5,44,1,"Sandwiches, Salad, Food, Restaurants, Delis"
How Lee Chinese Food,5888 Forbes Ave,Pittsburgh,PA,15217,40.4377788,-79.9195544,4.0,236,1,"Restaurants, Chinese"
Central Catholic High School,4720 5th Ave,Pittsburgh,PA,15213,40.4468846,-79.9458098,5.0,4,1,"Middle Schools & High Schools, Education"
Schiller's Pharmacy & Cosmetique,811 S Aiken Ave,Pittsburgh,PA,15232,40.4505938,-79.9352289,4.5,9,1,"Beauty & Spas, Shopping, Drugstores, Cosmetics & Beauty Supply"
Sterling Land Company,4611 Bayard St,Pittsburgh,PA,15213,40.450336,-79.950038,3.0,22,1,"Commercial Real Estate, Real Estate, Home Services, Apartments"
Anna's Animals,342 S Graham St,Pittsburgh,PA,15232,40.4605668,-79.9368243,5.0,6,1,"Pets, Session Photography, Pet Services, Event Planning & Services, Dog Walkers, Photographers"
Iron City Self Storage,3700 Bigelow Blvd,Pittsburgh,PA,15213,40.4581679,-79.9561895,4.5,8,0,"Home Decor, Self Storage, Home & Garden, Automotive, Shopping, Truck Rental, Local Services"
Popeyes Louisiana Kitchen,3616 5th Ave,Pittsburgh,PA,15213,40.4415369,-79.958418,2.0,30,1,"American (Traditional), Chicken Wings, Restaurants, Fast Food"
Fuku Tea,3800 Forbes Ave,Pittsburgh,PA,15213,40.4415422065,-79.9568209572,4.5,140,1,"Desserts, Coffee & Tea, Food, Bubble Tea"
Dollar General,4725 Centre Ave,Pittsburgh,PA,15213,40.4528784487,-79.9487121319,3.0,6,1,"Shopping, Discount Store"
"Horan Edward J, DMD",1825 Murray Ave,Pittsburgh,PA,15217,40.436431,-79.9226928,3.5,5,1,"General Dentistry, Dentists, Health & Medical"
Leone's Floral Shop,5504 Centre Ave,Pittsburgh,PA,15232,40.4565667,-79.936316,2.5,3,0,"Florists, Shopping, Flowers & Gifts"
Four Seasons Dry Cleaners,1716 Murray Ave,Pittsburgh,PA,15217,40.4373791,-79.9231677,2.0,27,1,"Dry Cleaning & Laundry, Laundry Services, Local Services, Sewing & Alterations, Dry Cleaning"
Forward Lanes,5844 Forward Ave,Pittsburgh,PA,15217,40.4292017,-79.9223235,3.5,20,0,"Active Life, Bowling"
Verizon Wireless,3601 Forbes Ave,Pittsburgh,PA,15213,40.440879,-79.958402,1.5,9,1,"Mobile Phones, Mobile Phone Accessories, Electronics, Shopping"
Sciulli's Pizza,3404 5th Ave,Pittsburgh,PA,15213,40.4391344,-79.961805,4.5,12,1,"Pizza, Restaurants"
It's Dogg'n It,1936 Murray Ave,Pittsburgh,PA,15217,40.4350444026,-79.9229464067,2.5,19,1,"Nightlife, Beer, Wine & Spirits, Food, Beer Bar, Bars"
Pasha Cafe Lounge,808 Ivy St,Pittsburgh,PA,15232,40.4510208759,-79.9320307374,4.5,99,1,"Breakfast & Brunch, Restaurants, Mediterranean, Turkish"
University of Pittsburgh Medical Center,200 Lothrop St,Pittsburgh,PA,15213,40.4425606,-79.9609827,2.5,14,1,"Health & Medical, Medical Centers, Doctors, Hospitals"
Pittsburgh Toy Lending Library,5401 Centre Ave,Pittsburgh,PA,15232,40.4566385,-79.9380702,5.0,5,1,"Public Services & Government, Libraries"
Capristo Salon & Wellness Spa,5850 Ellsworth Ave,Pittsburgh,PA,15232,40.4568156,-79.9293258,4.0,80,1,"Beauty & Spas, Skin Care, Hair Salons, Hair Stylists, Hair Extensions, Men's Hair Salons, Day Spas, Nail Salons, Massage, Hair Removal"
Mark\/Anthony Hair Salon,209 S Craig St,Pittsburgh,PA,15213,40.4460019,-79.9486193,4.0,13,1,"Cosmetics & Beauty Supply, Shopping, Beauty & Spas, Hair Removal, Hair Salons, Nail Salons"
Johnny's Place,256 N Craig St,Pittsburgh,PA,15213,40.45132,-79.951258,5.0,4,0,"Restaurants, American (Traditional)"
Beta Bites,338 S Bouquet St,Pittsburgh,PA,15213,40.4400088,-79.9532523,4.0,76,1,"Sandwiches, Mediterranean, Restaurants, Pizza, Seafood, American (Traditional), American (New), Moroccan"
Vanitybox Boutique,5892 Ellsworth Ave,Pittsburgh,PA,15232,40.4580184,-79.9275787,5.0,4,1,"Personal Shopping, Shopping, Beauty & Spas, Makeup Artists, Hair Removal, Skin Care, Waxing, Eyelash Service"
The Chocolate Moose,5830 Forbes Ave,Pittsburgh,PA,15217,40.4378381,-79.9216679,4.5,12,1,"Chocolatiers & Shops, Food, Candy Stores, Specialty Food"
Kristopher's Place,4239 Murray Ave,Pittsburgh,PA,15217,40.4220742,-79.928603,3.0,12,0,"Restaurants, Delis, Diners"
Athleta,5430 Walnut St,Pittsburgh,PA,15232,40.4507182,-79.9342365,4.0,6,1,"Swimwear, Shopping, Women's Clothing, Fashion"
S & T Nail Design,114 Meyran Ave,Pittsburgh,PA,15213,40.4407589,-79.958856,3.5,23,1,"Beauty & Spas, Nail Salons"
School of Dental Medicine,3501 Ter St,Pittsburgh,PA,15213,40.442615919,-79.9627954955,2.5,6,1,"Education, Health & Medical, Dentists, Colleges & Universities, Endodontists, General Dentistry"
The Knob Hall Winery,5884 Ellsworth Ave,Pittsburgh,PA,15232,40.4577825,-79.927921,5.0,6,0,"Food, Wineries, Wine Bars, Beer, Wine & Spirits, Nightlife, Arts & Entertainment, Bars"
Carnegie Mellon University Bookstore,5032 Forbes Ave,Pittsburgh,PA,15213,40.4433542,-79.9419274,3.5,6,1,"Books, Mags, Music & Video, Shopping"
Tazza D'Oro,"4902 Forbes Ave Gates Ctr, Fl 3, Carnegie Mellon",Pittsburgh,PA,15213,40.4435157487,-79.9447413906,4.5,25,1,"Food, Coffee & Tea"
Mercedes Benz of Pittsburgh,4709 Baum Blvd,Pittsburgh,PA,15213,40.4541357,-79.9496682,3.5,19,1,"Automotive, Car Dealers"
Walnut Grill,5500 Walnut St,Pittsburgh,PA,15232,40.4508247,-79.9334641,3.0,32,0,"American (New), Restaurants"
Squirrel Hill Flower Shop,1718 Murray Ave,Pittsburgh,PA,15217,40.437339,-79.923225,3.0,13,1,"Fruits & Veggies, Flowers & Gifts, Specialty Food, Food, Florists, Shopping"
Maximum Flavor Pizza Shop,415 S Craig St,Pittsburgh,PA,15213,40.4446869,-79.9485698,3.0,25,0,"Pizza, Restaurants"
Levin Mattress,5846 Forbes Ave,Pittsburgh,PA,15217,40.437745,-79.9211349,3.0,3,0,"Mattresses, Shopping, Furniture Stores, Home & Garden"
Up Modern Kitchen,5500 Walnut St,Pittsburgh,PA,15232,40.450952,-79.933592,3.5,59,0,"American (New), Restaurants, Italian"
Dress Circle,738 Bellefonte St,Pittsburgh,PA,15232,40.451308,-79.9341518,3.0,5,1,"Fashion, Women's Clothing, Accessories, Shopping"
DJ's Butcher Block,4623 Liberty Ave,Pittsburgh,PA,15232,40.4624772,-79.9499758,4.5,35,0,"Butcher, Specialty Food, Food, Meat Shops"
Schenley Oval,1 Overlook Dr,Pittsburgh,PA,15217,40.433218,-79.9421981096,3.0,5,1,"Tennis, Sports Clubs, Soccer, Active Life"
Fuel & Fuddle,212 Oakland Ave,Pittsburgh,PA,15213,40.4412454,-79.9566016,3.5,302,1,"American (Traditional), Gastropubs, Restaurants"
Conflict Kitchen,221 Schenley Dr,Pittsburgh,PA,15213,40.44258082,-79.9527347618,4.0,153,0,"Imported Food, Food, Specialty Food, Ethnic Food, Restaurants"
Wolfpack Trading,304 NCraig St,Pittsburgh,PA,15213,40.4522476,-79.9520365,4.5,3,1,"Electronics, Data Recovery, Electronics Repair, Local Services, IT Services & Computer Repair, Shopping, Mobile Phone Repair"
Girasole Restaurant,733 Copeland St,Pittsburgh,PA,15232,40.4512091,-79.9345684,4.0,356,1,"Restaurants, Italian"
Enrico's Hair Cutting for Men,3516 5th Ave,Pittsburgh,PA,15213,40.4408259,-79.9592919,4.5,26,1,"Hair Salons, Barbers, Men's Hair Salons, Beauty & Spas"
Perspolis Hookah Lounge,304 N Craig St,Pittsburgh,PA,15213,40.452254,-79.952033,5.0,3,0,"Ethnic Food, Specialty Food, Restaurants, Cafes, Nightlife, Food, Bars, Hookah Bars, Lounges"
Bagel Factory,5825 Ellsworth Ave,Pittsburgh,PA,15232,40.456795,-79.930231,2.5,42,0,"Bakeries, Restaurants, Bagels, Food"
Korea Garden,414 Semple St,Pittsburgh,PA,15213,40.4366464,-79.9547027,3.5,96,1,"Restaurants, Korean"
Acoustic Music Works,2142 Murray Ave,Pittsburgh,PA,15217,40.4324816,-79.9234192,3.0,13,1,"Shopping, Musical Instruments & Teachers"
Lulu's Noodles,400 S Craig St,Pittsburgh,PA,15213,40.445131,-79.9490568,3.0,394,1,"Chinese, Vegetarian, Pan Asian, Restaurants, Japanese, Korean, Noodles"
Le Mardi Gras,731 Copeland St,Pittsburgh,PA,15232,40.4512603,-79.9345876,4.0,57,1,"Dive Bars, Nightlife, Food, Bagels, Lounges, Bars"
Murray Avenue Grill,1720 Murray Ave,Pittsburgh,PA,15217,40.4372778,-79.9232382,3.5,132,1,"Restaurants, American (New)"
Rite Aid,5504 Walnut St,Pittsburgh,PA,15232,40.45107,-79.933499,3.0,8,1,"Drugstores, Food, Shopping, Convenience Stores"
Andrew Leo Hair Salon,5518 Walnut St,Pittsburgh,PA,15232,40.451153,-79.9329659,4.0,12,1,"Beauty & Spas, Hair Salons"
Eyetique,5418 Walnut St,Pittsburgh,PA,15232,40.450791,-79.934756,3.5,24,1,"Eyewear & Opticians, Optometrists, Shopping, Health & Medical"
Nu-Life Cleaners & Shirt Laundry,5613 Hobart St,Pittsburgh,PA,15217,40.432826,-79.927,2.0,7,0,"Dry Cleaning & Laundry, Local Services, Laundry Services"
Gaby Et Jules,5837 Forbes Ave,Pittsburgh,PA,15217,40.438345,-79.921365,4.0,207,1,"French, Bakeries, Specialty Food, Food, Restaurants, Macarons"
Nadia Salon,5519 Walnut St,Pittsburgh,PA,15232,40.4514844,-79.9331573,4.0,42,1,"Waxing, Hair Salons, Nail Salons, Beauty & Spas, Threading Services, Hair Removal"
The Elbow Room,5533 Walnut St,Pittsburgh,PA,15232,40.4516538606,-79.9327178369,3.0,85,0,"American (New), Restaurants"
Young's Oriental Grocery Store,5813 Forward Ave,Pittsburgh,PA,15217,40.4297296,-79.9228528,3.5,16,1,"Grocery, Food"
Manor Theatre,1729 Murray Ave,Pittsburgh,PA,15217,40.4372382936,-79.9228162449,4.5,90,1,"Arts & Entertainment, Cinema"
The Yard Gastropub,736 Bellefonte St,Pittsburgh,PA,15232,40.4513696,-79.9341804,3.5,285,1,"Burgers, American (New), Restaurants, Gastropubs"
A Childs Wardrobe,2200 Murray Ave,Pittsburgh,PA,15217,40.4322207,-79.9233157,5.0,3,1,"Fashion, Used, Vintage & Consignment, Shopping, Thrift Stores"
Garden View Cafe,300 Halket St,Pittsburgh,PA,15213,40.44432,-79.95492,3.5,3,1,"Cafes, Food, Salad, Sandwiches, Restaurants, Shopping, Coffee & Tea"
Anderson Jim Auto,4649 Centre Ave,Pittsburgh,PA,15213,40.4525213,-79.9502278,3.5,3,1,"Auto Repair, Automotive"
CVS Pharmacy,3440 Forbes Ave,Pittsburgh,PA,15213,40.4393,-79.9596,2.0,8,1,"Shopping, Health & Medical, Drugstores, Pharmacy"
Popeyes,107 Atwood St,Pittsburgh,PA,15213,40.4415876,-79.9582278,4.0,5,0,"Fast Food, Restaurants"
Peet's Coffee & Tea,3619 Forbes Avenue,Pittsburgh,PA,15213,40.4409995,-79.9577793,3.5,12,0,"Food, Coffee & Tea"
7-Eleven,3955 Forbes Ave,Pittsburgh,PA,15213,40.4429778682,-79.9550119042,3.0,4,1,"Food, Convenience Stores"
Burma-Tokyo,320 Atwood St,Pittsburgh,PA,15213,40.4390804,-79.9553126,4.0,37,0,"Japanese, Restaurants, Food, Burmese"
La Felice,5886 Forbes Ave,Pittsburgh,PA,15217,40.4379156138,-79.9195731864,2.0,4,1,"Italian, Pizza, Restaurants"
Blue Monkey Tea Pittsburgh,5872 Forbes Ave,Pittsburgh,PA,15217,40.4378605,-79.9201969,4.5,38,1,"Specialty Food, International Grocery, Herbs & Spices, Religious Organizations, Coffee & Tea, Shopping, Flowers & Gifts, Event Planning & Services, Local Flavor, Tea Rooms, Food"
Pittsburgh Center For the Arts,1047 Shady Ave,Pittsburgh,PA,15232,40.4517396,-79.9194888,3.5,5,1,"Specialty Schools, Art Schools, Education"
Salon Boheme,5741 Walnut St,Pittsburgh,PA,15232,40.4528453,-79.92905,4.5,3,1,"Beauty & Spas, Hair Salons"
Mad Mex - Oakland,370 Atwood St,Pittsburgh,PA,15213,40.438019,-79.954209,3.5,271,1,"Restaurants, Mexican, Tex-Mex"
It's Dogg'n It,260 Atwood St,Pittsburgh,PA,15213,40.4396266,-79.9561711,3.0,3,1,"Food, Restaurants, Beer, Wine & Spirits"
Ramen Bar,5860 Forbes Ave,Pittsburgh,PA,15217,40.4379625915,-79.9206533432,3.5,285,1,"Bars, Ramen, Nightlife, Restaurants, Japanese"
Forbes Tobacco,3801 Forbes Ave,Pittsburgh,PA,15213,40.4417308,-79.9570176,1.0,3,1,"Shopping, Tobacco Shops"
Berman Chiropractic,2301 Murray Ave,Pittsburgh,PA,15217,40.4315941301,-79.9230858405,5.0,6,1,"Chiropractors, Massage Therapy, Health & Medical"
Click Nathan,5826 Pierce St,Pittsburgh,PA,15232,40.4570303,-79.9303884,5.0,3,1,"Professional Services, Web Design"
Giant Eagle Market District,5550 Centre Ave,Pittsburgh,PA,15232,40.4564927,-79.9346055,3.0,104,1,"Drugstores, Shopping, Delis, Restaurants, Grocery, Food"
Timothy's of Squirrel Hill,5843 Forbes Ave,Pittsburgh,PA,15217,40.4381768,-79.9212196,4.0,6,0,"Nail Salons, Beauty & Spas, Hair Salons"
Taiwan Cafe,3725 Forbes Ave,Pittsburgh,PA,15213,40.4415892334,-79.9571999251,3.5,31,0,"Taiwanese, Restaurants"
Cogo's,4071 Beechwood Blvd,Pittsburgh,PA,15217,40.4266504,-79.9383042,3.5,4,1,"Automotive, Grocery, Food, Convenience Stores, Gas Stations"
PGH Baby Equipment Rentals,,Pittsburgh,PA,15217,40.4327086,-79.9248669,5.0,9,1,"Baby Gear & Furniture, Shopping"
Aseoma,2018 Murray Ave,Pittsburgh,PA,15217,40.4341914,-79.9230121,4.0,20,0,"Restaurants, Food, American (New), Specialty Food, Chinese, Asian Fusion"
Pallantia Tapas de España,810 Ivy St,Pittsburgh,PA,15232,40.451213,-79.932284,4.0,105,0,"Bars, Restaurants, Cocktail Bars, Nightlife, Tapas Bars, Spanish, Tapas\/Small Plates, Wine Bars"
Lou's Auto Service & Sales,4619 Centre Ave,Pittsburgh,PA,15213,40.4523965,-79.9513919,4.5,15,1,"Auto Repair, Automotive"
15°fahrenheit Rolled Icecream,1722 Murray Ave,Pittsburgh,PA,15217,40.4372329053,-79.923029731,3.5,9,1,"Food, Ice Cream & Frozen Yogurt"
Noodle Uchi,415 S Craig St,Pittsburgh,PA,15213,40.4446200743,-79.9486014247,2.5,13,0,"Salad, Restaurants, Noodles, Ramen, Japanese"
Shadyside Dentistry,5888 1\/2 Ellsworth Ave,Pittsburgh,PA,15232,40.457783,-79.927793,5.0,12,1,"Dentists, Health & Medical, Cosmetic Dentists, General Dentistry"
Quest Diagnostics,"4815 Centre Ave, Ste 106",Pittsburgh,PA,15213,40.4537477044,-79.9468666281,3.5,3,1,"Laboratory Testing, Health & Medical, Diagnostic Services"
Instyle Hair Salon,5815 Forbes Ave,Pittsburgh,PA,15217,40.4381696,-79.9223047,4.0,26,1,"Hair Salons, Beauty & Spas, Hair Stylists"
Miss Saigon88,258 N Craig St,Pittsburgh,PA,15213,40.4512474328,-79.9514841288,3.0,25,0,"Thai, Restaurants, Chinese, Vietnamese"
Crepes Parisiennes,732 Filbert St,Pittsburgh,PA,15232,40.4516361,-79.9333919,4.0,72,0,"French, Restaurants, Creperies, Breakfast & Brunch"
Say Cheese! Pizza,3507 Cable Pl,Pittsburgh,PA,15213,40.4366326,-79.953824,3.5,22,0,"Pizza, Restaurants"
Club Laga,3609 Forbes Ave,Pittsburgh,PA,15213,40.4409738,-79.9581686,4.0,4,0,Nightlife
